228,Three,"Hackers broke into Three's customer database with the intention of fraudulently ordering handsets to sell on. They stole personal details, but no financial records or passwords were stored on the hacked system. ",2017,telecoms,hacked,200000,20,
229,Wonga,Apr. Customers from the UK and Poland look to have been affected. ,2017,financial,hacked,270000,50000,
230,PayAsUGym,Dec. Fitness website hacked & email address published online.,2017,web,hacked,300000,1,
231,Red Cross Blood Service,Info leaked includes data about 'at risk sexual behaviours',2017,healthcare,accidentally published,550000,4000,
232,DaFont,"May. Apparently the hacker found out others were selling the site's database, so he decided to get in on the action himself.",2017,web,hacked,700000,4000,
233,Brazzers,"Sept. 'The data contains 790,724 unique email addresses, and also includes usernames and plaintext passwords. (The set has 928,072 entries in all, but many are duplicates.'",2017,web,hacked,790724,4000,
234,Snapchat,Apr. Indian hackers apparently leaked data they stole last year in response to Snapchat CEO allegedly stating they had no plans to expand to 'poor countries' like India. Snapchat have yet to confirm any leak.,2017,app,hacked,1700000,1,
235,Bell,Somebody claiming to be behind the attack has threatened Bell with more leaks if they don't cooporate. ,2017,telecoms,hacked,1900000,1,
236,Cellebrite,"Cellebrite's main product is a device that rips data from mobile phones. 900GB of data was stolen from Cellebrite. The hackers got hacked. The number of records taken is unknown. 
",2017,tech,hacked,3000000,20,
237,Clinton campaign,,2017,government,hacked,5000000,20,
238,ClixSense,"Sept. The information stolen contains usernames, passwords, home addresses, payment histories, and other banking details.",2017,web,hacked,6600000,50000,
239,Lynda.com,"Hackers breached a database that held records of contact info and courses viewed. No official statement yet on how many records were actually stolen, and no evidence yet of them having been published anywhere.",2017,web,hacked,9500000,1,
240,Interpark,July. South Korean police are blaming North Korea for stealing data in an attempt to obtain foreign currency. ,2017,web,hacked,10000000,20,
241,Zomato,The hacker is selling the stolen dataset for around $1000. ,2017,web,hacked,17000000,4000,
242,Yahoo,User accounts have been hacked using forged cookies to log in without a password over a 2 year period. ,2017,web,hacked,32000000,4000,
243,Weebly,"Feb. Usernames, passwords and IP addresses stolen, although passwords secured with bcrypt. ",2017,web,hacked,43000000,4000,
244,Dailymotion,"85.2m email addresses extracted, but only 18.3m had associated passwords.",2017,web,hacked,85200000,1,
245,Friend Finder Network,"Usernames, email addresses, passwords for sites including Adult Friend Finder and Penthouse.com. Passwords encrypted, but LeakedSource claims to be able to crack 99% of them.",2017,web,hacked,412000000,1,ZDNet / LeakedSource
246,River City Media,"A dodgy backup has allegedly resulted in over a billion leaked email addresses, plus other personal info in some cases, and has exposed RCM's business plans & operations. ",2017,web,accidentally published,700000000,20,
247,Telegram ,"Despite Telegram's claims of super security, they've been hacked by a group called Rocket Kitten. ",2017,tech,hacked,15000000,1,
248,Waterly,Jan 2017. Israel-based app contained a vulnerability in the sign-in process that could potentially expose user account details. The problem was fixed within 2 weeks of being identifiied. ,latest,app,poor security,1000000,300,
249,CEX,"A misconfigured spambot leaked full contact info & financial details, although the newest financial data dates to 2009. ",latest,retail,accidentally published,2000000,300,
250,Swedish Transport Agency,"Information about all vehicles in the country (including military and police), made available to IT workers who hadn't been through usual security checks. The question of whether or not Sweden's national security was harmed is censored in the Säpo (Sweden's security police) report.",latest,government,poor security,3000000,50000,
251,Instagram,"A bug exposed user's contact information. Instagram initially said it affected only verified accounts, but has now admitted non-verified users were also affected. Instagram hasn't confirmed numbers, but hackers say they have info from 6m accounts.",latest,web,hacked,6000000,1,
252,Equifax,"If you have a credit report, there’s a good chance that you’re one of the 143 million American consumers whose sensitive personal information was exposed in a data breach at Equifax, one of the nation’s three major credit reporting agencies.",latest,financial,hacked,143000000,50000,
253,Spambot,"A misconfigured spambot has leaked over 7m records, although many of them are likely to be fake or repeated accounts.",latest,web,poor security,711000000,4000,
