112,South Carolina Government,"A man was charged with five counts of violating medical confidentiality laws and one count of disclosure of confidential information after he gained access to personal information for more than 228,000 Medicaid beneficiaries.",2012,healthcare,inside job,200000,4000,
113,Emory Healthcare,"The company 'misplaced' 10 discs containing sensitive information, including social security numbers. ",2012,healthcare,lost / stolen device,300000,4000,
114,Formspring,"Formspring was tipped off to a breach after 420,000 hashed passwords were posted to a security forum. ",2012,web,hacked,400000,1,
115,Yahoo Voices,"Yahoo Voices service was hacked, exposing more than 450,000 usernames and passwords.",2012,"tech, web",hacked,500000,1,Slashdot
116,Medicaid,"The Utah Department of Technology Services had recently moved their claims records to a new server, and hackers believed to be operating out of Eastern Europe were able to circumvent the server’s multi-layered security system containing Social Security numbers for the Medicaid claims.",2012,"government, healthcare",hacked,800000,20,ITRC
117,California Department of Child Support Services,California child support records were lost in transit during a disaster preparedness exercise.,2012,government,lost / stolen device,800000,20,ITRC
118,Global Payments,1.5 million credit card numbers from its systems may have been exposed after detecting “unauthorized access” into its processing system. ,2012,financial,hacked,1500000,300,ITRC
119,New York State Electric & Gas,An employee from a software consulting firm was allowed unauthorized access to the company’s databases.,2012,energy,inside job,1800000,20,ITRC
120,Three Iranian banks,"After finding a security vulnerability in Iran's banking system, software manager Khosrow Zarefarid
 wrote a formal report and sent it to the CEOs of all the affected banks across the country. When the banks ignored his findings, he hacked 3 million bank accounts, belonging to at least 22 different banks, to prove his point.",2012,financial,hacked,3000000,50000,ZD Net
121,Office of the Texas Attorney General,The office of Texas Attorney General Greg Abbott mistakenly gave attorneys access to millions of Social Security numbers in a case against the state’s voter ID law,2012,government,accidentally published,6500000,20,
122,"LinkedIn, eHarmony, Last.fm","Hacker 'dwdm' uploaded a file containing 6.5 million passwords on a Russian hacker forum. Soon after another 1.5 million passwords were discovered.  On analysis, 93% of the passwords could be found in the Top 10,000 password list.",2012,web,hacked,8000000,1,
123,Gamigo,German gaming website,2012,web,hacked,8000000,1,
124,KT Corp.,"Two suspects reportedly earnt an estimated $877,000 by selling the contact information and plan details of 8.7 million KT subscribers, almost half of the carrier's total customers.",2012,telecoms,hacked,8700000,20,
125,Greek government,"A computer programmer was arrested in Greece for allegedly stealing the identity information of what could amount to 83% of the country's population. The 35-year-old was found in possession of 9 million data files containing identification card data, addresses, tax ID numbers and licence plate numbers, which he was also suspected of trying to sell.",2012,government,hacked,9000000,20,Wired
126,"""Apple""","Hacking group AntiSec claimed they hacked an FBI laptop in March 2012 accessing a file of more than 12 million Apple Unique Device Identifiers (UDIDs). Subsequently, it was discovered that app developer BlueToad was the source of the breach. The list contained personal information such as full names, phone numbers and addresses. AntiSec published a million of these UDIDs online.",2012,"tech, retail",accidentally published,12400000,20,
127,Blizzard,"Scrambled passwords, e-mail addresses, and personal security answers were knowingly stolen from Blizzard's internal network. Blizzard would not elaborate on the size of the hack (""millions""). ",2012,gaming,hacked,14000000,20,
128,Zappos,,2012,web,hacked,24000000,20,
129,Last.fm,"Historical 2012 hack, details have only just been disclosed.",2012,web,hacked,43500000,1,
130,Dropbox,"User credentials were stolen in a 2012 hack, but the number affected has only just come to light. ",2012,web,hacked,68700000,1,
131,Massive American business hack,"Over eight years, a hacking ring targeted banks, payment processors and chain stores, to steal more than 160 million credit and debit card numbers, targeting more than 800,000 bank accounts ",2012,financial,hacked,160000000,50000,
132,Court Ventures,"A Vietnamese identity theft service was sold personal records, including Social Security numbers, credit card data and bank account information, by Court Ventures, a company now owned by data brokerage firm Experian.",2012,financial,inside job,200000000,20,NY Times / Experian
133,LinkedIn,Information about a 2012 data breach has just come to light. ,2012,web,hacked,117000000,1,
134,South Carolina State Dept. of Revenue,A server was breached by an international hacker.,2012,government,hacked,3600000,3,
135,Central Hudson Gas & Electric,Customer banking information and other personal information may have been accessed during the hack.,2013,energy,hacked,100000,300,Privacy Rights
136,"Crescent Health Inc., Walgreens","Names, Social Security numbers, health insurance identification numbers, health insurance information, dates of birth, diagnoses, other medical information, disability codes, addresses, and phone numbers may have been exposed via a laptop theft.",2013,healthcare,lost / stolen device,100000,4000,Privacy Rights
137,Florida Courts,,2013,government,lost / stolen device,100000,20,Privacy Rights
138,Florida Department of Juvenile Justice,"Three computers were stolen that contained both youth and employee records was reported stolen on January 2, 2013.  Over 100,000 records were on the device and may have been exposed.",2013,government,lost / stolen device,100000,20,Privacy Rights
139,Kirkwood Community College,,2013,academic,hacked,130000,20,Privacy Rights
140,Citigroup,"Third big data breach from Citigroup.""The personal information of 150,000 consumers who went into bankruptcy between 2007 and 2011 – including their social security numbers – were exposed after Citi failed to properly redact court records before they were put on the Public Access to Court Electronic Records (PACER) system.""",2013,financial,accidentally published,150000,20,
141,Indiana University,Students who attended the university between 2011 and 2014 may have had their data exposed after it was stored on an unprotected site. The data was accessed by three webcrawlers but there is not evidence it was accessed by any unauthorized individuals.,2013,academic,poor security,150000,20,Indiana University
142,Washington State court system,"Up to 160,000 Social Security numbers and a million driver's license numbers may have been accessed by hackers exploiting old versions of Adobe Cold Fusion software on the server. ",2013,government,hacked,160000,20,Reuters; Privacy Rights
143,TerraCom & YourTel,"The telecom firms TerraCom and YourTel have branded reporters for Scripps News as ""hackers"" after journalists discovered that the personal data of over 170,000 customers - including social security numbers and other identifying data that could be used for identity theft - were sitting on a publicly accessible server.",2013,telecoms,accidentally published,180000,20,Boing Boing; Wired
144,Nintendo,"Japan's Club Nintendo service was hacked following thousands of unauthorized accesses. Customer information compromised in the attack includes full names, phone numbers, home and email addresses.",2013,gaming,hacked,250000,20,
145,Twitter,"Hackers had access to limited user information -- usernames, email addresses, session tokens and encrypted/salted versions of passwords -- for approximately 250,000 users.",2013,web,hacked ,250000,1,Wired
146,Apple,"Developer portal hacked. ""Some"" information about 275,000 3rd-party developers potentially stolen.",2013,tech,hacked,300000,1,
147,OVH,,2013,web,hacked,500000,20,
148,Scribd,Hack resulted in a few hundred thousand stolen passwords.,2013,web,hacked,500000,1,Naked Security; NBC News
149,Drupal,"Malicious files placed on association.drupal.org servers via a 3rd-party application. Exposed usernames, e-mail addresses, country information, and cryptographically hashed passwords.",2013,web,hacked,1000000,1,Ars Technica
150,NMBS,"Data stored on a non-secure server, making it possible to access names, gender, DOB, email and postal address data of customers externally by means of a simple search engine query. Most of the data belong to customers in Belgium, France and the UK, including thousands of Commission and Parliament employees.  Caused, the NMBS said, by a data worker “clicking on the wrong button”.",2013,transport,accidentally published,1500000,20,European Parliament
151,National Security Agency,"Snowden downloaded up to 1.5 million files, then flew to Hong Kong to meet journalists Glenn Greenwald and Laura Poitras before fleeing to Moscow. ",2013,government,inside job,1500000,50000,
152,Kissinger Cables,Wikileaks,2013,government,inside job,1700000,300,
153,Ubuntu,July 2013: Discussion forum for the operating system was compromised leaking personal details and password. The passwords were cryptographically scrambled using the MD5 hashing algorithm - considered an inadequate means of protecting stored passwords by security experts.,2013,tech,hacked,2000000,300,Data Loss Database
154,Vodafone,An IT contractor for the firm used his deep access to the telecom giant's system to copy customer names and bank account details.,2013,telecoms,inside job,2000000,300,Security Week
155,ssndob.ms,"SSNDOB was an underground identity theft service. Teenage hackers used it to collect data for exposed.su, a site that listed the SSNs, birthdays, phone numbers, current and previous addresses for dozens of top celebrities including Beyonce, Kanye West and Michelle Obama. In doing so they revealed SSNDOB had data on more than 4 million people.",2013,web,hacked,4000000,20,Krebs on Security
156,Advocate Medical Group,"4,000,000 patient names, addresses, dates of birth, and Social Security numbers were contained in four computers stolen from an administrative building. Second biggest security breach ever reported to the Department of Health and Human Services (HHS).",2013,healthcare,lost / stolen device,4000000,20,
157,SnapChat,"31st Dec 2013. Hackers abused an exploit to syphon 4.7m user details, including phone numbers.  Check here to see if your account was compromised: http://lookup.gibsonsec.org/",2013,"web, tech",hacked,4700000,20,
158,Facebook,"Using the network's ""Download Your Information"" tool, some Facebook members were inadvertently sent the phone numbers or email address of Facebook friends that were otherwise private. Facebook assured users that the bug was fixed within a day, and that there is no evidence that the information was used maliciously.",2013,web,accidentally published,6000000,1,
159,Yahoo Japan,22 million Yahoo user IDs may have been leaked after Yahoo detected an unauthorized attempt to access the administrative system of its web portal Yahoo Japan. The leaked information did not include passwords and data necessary for identity verification to reset passwords.,2013,"tech, web",hacked,22000000,1,Reuters
160,Adobe,"Sep 17th 2013. Hackers obtained access to a large swathe of Adobe customer IDs and encrypted passwords & removed sensitive information (i.e. names, encrypted credit or debit card numbers, expiration dates, etc.). Approximately 36 million Adobe customers were involved: 3.1 million whose credit or debit card information was taken and nearly 33 million active users whose current, encrypted passwords were in the database taken. Correction Jan 2015: we previously reported 152m records were taking, but the remainder affected invalid, inactive, test accounts or had out-of-date passwords associated with them.",2013,tech,hacked,36000000,50000,
161,Evernote,"Evernote asked its 50 million users to reset their passwords following an attempt to hack the note-taking network. The company said it’d found no evidence that any payment information for Evernote Premium or Evernote Business customers had been accessed, nor was there any indication that content stored by users had been accessed, changed or lost.",2013,web,hacked,50000000,1,Wired; Digital Trends
162,Living Social,"Online criminals gained access to user names, e-mail addresses, dates of birth & encrypted passwords for 50 million people. Databases storing financial information were not compromised in the attack, the company said.",2013,web,hacked,50000000,1,Naked Security; New York Times
163,UbiSoft,,2013,gaming,hacked,58000000,20,
164,Yahoo,"Happened in 2013 but only disclosed late 2016. Data included names, telephone numbers, DOBs, passwords and security questions. ",2013,web,hacked,1000000000,20,
165,Tumblr,"Tumblr apparently only just found out about a 2013 data breach, affecting 65m users. ",2013,web,hacked,65000000,1,
166,New York Taxis,"A freedom of information request resulted in the release of data on all 173 million journeys undertaken by New York taxis in one year. Unfortunately, the data was incorrectly anonymised and relatively easy to decode, revealing the driver IDs, pickup & dropoff times, and GPS routes taken for every single cab journey.",2014,transport,poor security,52000,1,
167,NASDAQ,"Nasdaq forum website hacked by hacking ring, email addresses and passwords compromised",2014,financial,hacked,500000,1,
168,Dominios Pizzas (France),,2014,web,hacked,600000,1,
169,Japan Airlines,"Oct 2014: Japan Airlines confirmed the possible theft of information from up to around 750,000 frequent-flier programme members. Data that may have been stolen included names, genders, birth dates, addresses, email addresses and places of work.",2014,transport,hacked,800000,20,
170,Mozilla,,2014,web,poor security,800000,20,
171,MacRumours.com,,2014,web,hacked,900000,1,
172,"D&B, Altegrity","Hackers stole millions of social security numbers from large US data brokers Dun & Bradstreet Corp and Kroll Background America Inc, owned by Altegrity. Correction 7 Jan 2015: we previously stated that records were stolen from LexisNexis. LexisNexis conducted a thorough investigation of the malware intrusion and found no evidence that the malware accessed or stole any customer or consumer data. ",2014,tech,hacked,1000000,300,USA Today; Reuters; BBC News
173,Neiman Marcus,,2014,retail,hacked,1100000,20,
174,Staples,,2014,retail,hacked,1200000,300,
175,European Central Bank,,2014,financial,hacked,4000000,1,
176,UPS,Malware was discovered in the credit & debit card processing systems at 51 branches in 24 states.,2014,retail,hacked,4000000,300,
177,Community Health Systems,"Aug 2014: Community Health Systems, which operates 206 hospitals across the US, had patient data from the last 5 years breached. Details included names, addresses, social security numbers. Suspected ""chinese hackers"" were thought responsible. Goal: identity theft.",2014,healthcare,hacked,4500000,20,
178,"""Gmail""","5 million Gmail account passwords leaked to a forum, alongside passwords from other email providers. Close inspection revealed the user details to be old (3+ years). Multiple individual targeted hacks of third party websites where people used their Gmail IDs, rather than one big dataleak, suspected to be the method. Gmail itself was not hacked. ",2014,web,hacked,5000000,1,
179,Sony Pictures,"Wide-ranging hack of potentially every piece of data held by the company, including: unreleased films & scripts, employee social security numbers, salaries and health check results, as well as sensitive internal business documents relating to lay-offs, restructures and executive salaries. Lead suspects are ""North Korean hackers"" perhaps related to the Seth Rogen film, ""The Interview"" which mocks the North Korean dictator, Kim Jong Un.",2014,media,hacked,10000000,20,
180,Twitch.tv,March 23rd. Details unknown at this point. All Twitch's 10 million users have been requested to change their passwords.,2014,healthcare,hacked,10000000,1,
181,Korea Credit Bureau,,2014,financial,inside job,20000000,50000,
182,AOL,,2014,web,hacked,24000000,1,
183,Home Depot,"Malware installed on cash register system across 2,200 stores syphoned credit card details of up to 56 million customers. May be the same group of Russian and Ukrainian hackers responsible for the data breaches at Target, Sally Beauty and P.F. Chang’s, among others",2014,retail,hacked,56000000,300,
184,Target,Investigators believe the data was obtained via software installed on machines that customers use to swipe magnetic strips on their cards when paying for merchandise at Target stores. Originally 40m customers. Now 70m!,2014,retail,hacked,70000000,300,ITRC
185,JP Morgan Chase,"July 2014: The US's largest bank was compromised by hackers, stealing names, addresses, phone numbers and emails of account holders. The hack began in June but was not discovered until July, when the hackers had already obtained the highest level of administrative privilege to dozens of the bank’s computer servers.",2014,financial,hacked,76000000,300,
186,Ebay,The company has said hackers attacked between late February and early March with login credentials obtained from “a small number” of employees. They then accessed a database containing all user records and copied “a large part” of those credentials.,2014,web,hacked,145000000,1,
187,Yahoo,"Happened in 2014, but no. records stolen was originally thought to be much smaller. Yahoo recently revealed the real numbers.",2014,web,hacked,500000000,20,
188,Invest Bank,"Hacker breached a United Arab Emirates bank, demanding a ransom of $3m in bitcoin to stop tweeting data, mostly about corporate accounts. The hacker dumped files on the website of a basketball team, which he hacked for storage. The bank, Invest Bank, won't pay the ransom.  ",2015,financial,hacked,40000,50000,
189,Uber,"Occured Sep 2014. Revealed Feb 2015. Names & license plates of 50,000 driver partners.",2015,tech,poor security,50000,1,
190,IRS,"""An unnamed cybermafia used an IRS app to download forms full of personal information. They posed as legitimate taxpayers, and tried to download forms on 200,000 people between February and May. They got away with half of them, the IRS said. The crooks used about 15,000 of them to claim tax refunds in other people's names.""",2015,government,hacked,100000,1,
191,TalkTalk,"157k customers had personal details stolen, including 15,600 account numbers. ",2015,web,hacked,160000,20,
192,MSpy,"Data dump to the dark web ""includes Apple IDs and passwords, tracking data, and payment details on some 145,000 successful transactions"", photos and very private conversations.",2015,tech,hacked,400000,20,
193,Australian Immigration Department,"An employee of the agency inadvertently sent the passport numbers, visa details and other personal identifiers of all world leaders attending the G20 Brisbane summit to the organisers of the Asian Cup football tournament. Barack Obama, Vladimir Putin, Angela Merkel, Xi Jinping, Narendra Modi, David Cameron and many others.",2015,government,accidentally published,500000,50000,
194,British Airways,,2015,retail,hacked,500000,1,
195,Hacking Team,"Italian cybersecurity firm sells digital surveillance software to law enforcement and national security organisations. 400 GB of documents - including software source code, private messages & client databases - has been stolen and put online  via BitTorrent. The documents show the company has sold products to repressive regimes.",2015,web,hacked,500000,50000,The Guardian
196,Slack,,2015,tech,hacked,500000,1,
197,Carefirst,Attacked happened in June 2014. Was announced in June 2015.,2015,healthcare,hacked,1100000,1,
198,CarPhone Warehouse,,2015,web,hacked,2700000,50000,
199,Sanrio,"Security researcher was able to access a database of 3.3m of Sanrio's Sanriotown.com accounts, with links to other Sanrio Hello Kitty portals.",2015,web,poor security,3300000,20,
200,Adult Friend Finder,"Sexual preferences, names, email addresses, usernames, dates of birth, postal codes",2015,web,hacked,3900000,1,
201,US Office of Personnel Management,"""The intruders... gained access to...employees’ Social Security numbers, job assignments, performance ratings and training information""",2015,government,hacked,4000000,20,
202,VTech,"Software used to download games to children's computer tablets was hacked, with personal info and photos stolen. ",2015,web,hacked,6400000,50000,
203,Premera,"Detected 29th Jan 2015. Occured May 2014. ""C could include names, date of birth, email address, address, telephone number, Social Security number, member identification numbers, bank account information, and claims information, including clinical information""",2015,healthcare,hacked,11000000,50000,
204,Kromtech,"A security researcher stumbled on a leak, which exposed usernames, email addresses and passwords of users. He notified Kromtech, who patched it quickly. ",2015,web,hacked,13000000,1,
205,Experian / T-mobile,"The world's biggest data monitoring firm disclosed a massive breach of customers who applied for service with T-Mobile. Names, addresses, birth dates, Social Security numbers, drivers license numbers and passport numbers.",2015,web,hacked,15000000,300,
206,US Office of Personnel Management (2nd Breach),"attackers have targeted the forms submitted by intelligence and military personnel for security clearances. The document includes personal information - everything from eye colour, to financial history, to past substance abuse, as well as contact details for the individual's friends and relatives",2015,government,hacked,21500000,50000,
207,AshleyMadison.com,"20th July 2015: DEVELOPING: Online hookup site for extra-marital affairs has been severely breached and the personal details of 37m users, as well as company financial records, threatened with release. Notorious hacking outfit The Impact Team has claimed responsibility. The hackers are demanding the shutdown of AM.com and other associated sites.",2015,web,hacked,37000000,1,
208,Securus Technologies,"Anonymous hacker leaked records of over 70m phone calls, plus links to recordings. Recording/storing attorney-client calls potentially violates constitutional protections.",2015,web,hacked,70000000,50000,
209,Deep Root Analytics,A database of 198 million US voters has been exposed as a result of incorrect configuration. ,2015,web,poor security,198000000,20,"Reuters, UpGuard"
210,Syrian government,"Hacking outfit calling itself 'Cyber Justice Team' leaked 10GB of data from the government and private websites. Seems to be just data from old leaks, though.",2016,government,hacked,274477,1,
211,Minecraft,Players using the Lifeboat servers have had their email addresses and passwords leaked.,2016,web,hacked,7000000,1,
212,Mossack Fonseca,"2.6TB of data on politicians, criminals, professional athletes etc leaked from law firm Mossack Fonseca, including emails, contracts, scanned documents, transcripts...",2016,legal,hacked,11500000,50000,
213,Mail. ru,Two hackers attacked three game-related forums hosted by Russian company Mail.ru. ,2016,web,hacked,25000000,20,
214,Fling,"A hacker claims to be selling info on sexual desires & preferences, as well as generic personal info, stolen from the dating site Fling. ",2016,web,hacked,40000000,4000,
215,Turkish citizenship database,Turkish citizenship database has allegedly been hacked and leaked online.,2016,government,hacked,49611709,20,
216,Philippines’ Commission on Elections,"After a message was posted on the COMELEC website by hackers from Anonymous, warning the government not to mess with the elections, the entire database was stolen and posted online. ",2016,government,hacked,55000000,50000,
217,Anthem ,"Feb 2015: Names, dates of birth, member ID/ social security numbers, addresses, phone numbers, email addresses and employment information.",2016,healthcare,hacked,80000000,20,
218,VK,"Over 100m user accounts were hacked and the data put up for sale online. A VK spokesperson has denied that the site was breached, claiming the data for sale is old details no longer in use.",2016,web,hacked,100544934,4000,
219,Wendy's,Malware has been used in 1025 of Wendy's restaurants to steal credit card data from customers. It's currently unknown how many individuals have been impacted.,2016,retail,hacked,1025,300,
220,Mutuelle Generale de la Police,Files uploaded to Google Drive by a 'malicious' employee. Data included home addresses. The leak came two weeks after a French police officer was murdered by ISIS-inspired attack.,2016,healthcare,inside job,112000,50000,
221,MySpace,"The same hacker who was selling LinkedIn user data now claims to have MySpace user data too, and lots of it. ",2016,web,hacked,164000000,1,
222,Linux Ubuntu forums,,2016,web,hacked,2000000,1,
223,World Check,"2014 version of World-Check, a database of suspected terrorists and criminals, leaked online. It's unclear what data the records include.",2016,media,poor security,2200000,300,
224,uTorrent ,"It's unclear what data has been breached, exactly, but uTorrent has advised passwords are probably compromised. ",2016,web,hacked,35000,1,
225,Banner Health,Hackers gained access to payment card data via food outlets at Banner Health locations.,2016,healthcare,hacked,3700000,300,
226,Privatization Agency of the Republic of Serbia,A text file with personal data and financial documents were made publically available on their website. ,2016,government,accidentally published,519396,20,
227,Quest Diagnostics,"Nov. The stolen data contained names, DOBs, lab results and some telephone numbers.",2017,healthcare,hacked,34000,4000,
